자원ID,자원명,설명,초기값,최소값,최대값,증가요인,감소요인,게임오버영향,표시방식,비고
RES-001,혈액 재고,가문이 확보한 혈액 총량,50,0,100,헌혈센터 운영 성공; 비밀 거래 성공,가문 소비; 사고; 폐기,0 도달 시 위기 이벤트 발생,숫자/게이지,
RES-002,가문 자금,운영 가능한 자금,100,0,999,후원; 거래; 은폐 성공,매수; 설비; 사고 처리,0 도달 시 운영 제한,숫자,
RES-003,가문 위신,카르테인 가문의 내부 평가,50,0,100,가문 요구 충족; 비밀 유지,혈액 부족; 실패; 반항,낮을수록 압박 증가,게이지,
RES-004,인간 신뢰,표면 조직에 대한 인간 사회의 신뢰,50,0,100,정상 운영; 봉사 이미지; 언론 대응,실종 의혹; 민원; 폭로,0 도달 시 외부 조사 강화,게이지,
RES-005,언론 노출,외부 언론이 의혹을 추적하는 정도,10,0,100,사건; 제보; 기자 추적,은폐; 회유; 정보 차단,100 도달 시 폭로 루트,위험 게이지,
RES-006,조직 불안,내부 직원과 하부 조직의 동요,20,0,100,과로; 실패; 불공정 배분,보상; 질서 유지; 설득,100 도달 시 내부 배신,위험 게이지,
RES-007,보안 등급,조직의 비밀 유지 수준,50,0,100,보안 투자; 감시; 기록 조작,침입; 실수; 내부 누출,낮을수록 사건 증가,등급/게이지,
RES-008,가문 만족도,원로와 가문 핵심부의 만족도,50,0,100,혈액 공급; 위기 통제,공급 부족; 노출 위험; 손실,0 도달 시 강제 개입,게이지,
